{"schemaVersion":1,"updatedAt":10,"books":[{"book":{"id":"0E7B7B49-9652-4E82-BA2E-84F58CC90D46","title":"Tie","fileName":"tie.txt","format":"txt","addedAt":1,"modifiedAt":10},"sha256":"aaaaaaaaaaaaaaaaaaaaaaaaaaaaaaaaaaaaaaaaaaaaaaaaaaaaaaaaaaaaaaaa"}],"deletions":[{"bookID":"0E7B7B49-9652-4E82-BA2E-84F58CC90D46","deletedAt":10}]}
