{"schemaVersion":1,"updatedAt":812345678.125,"books":[{"book":{"id":"0E7B7B49-9652-4E82-BA2E-84F58CC90D46","title":"A Full Record","author":"Author","briefDescription":"Description","fileName":"sample.epub","format":"epub","addedAt":800000000.125,"lastOpenedAt":812000000.75,"progress":0.625,"isBookmarked":true,"modifiedAt":812345678.125},"sha256":"0123456789abcdef0123456789abcdef0123456789abcdef0123456789abcdef"}],"deletions":[{"bookID":"0E7B7B49-9652-4E82-BA2E-84F58CC90D46","deletedAt":800000001.5}],"conversations":[{"id":"11345678-9652-4E82-BA2E-84F58CC90D46","title":"Question","messages":[{"id":"22345678-9652-4E82-BA2E-84F58CC90D46","role":"user","text":"Why?","createdAt":812345677.875},{"id":"32345678-9652-4E82-BA2E-84F58CC90D46","role":"assistant","text":"Because.","createdAt":812345678.125}],"bookID":"0E7B7B49-9652-4E82-BA2E-84F58CC90D46","bookTitle":"A Full Record","bookDescription":"Description","selectedText":"A passage","bookContext":"Saved context","contextDescription":"Excerpt","includeBookContext":true,"createdAt":812345677.875,"modifiedAt":812345678.125}],"conversationDeletions":[]}
